<?xml version="1.0" ?>

<xs:schema xmlns:xs="http://www.w3.org/2001/XMLSchema">

    <xs:element name="user">
        <xs:complexType>
            <xs:sequence>
                <xs:element name="username" type="xs:string" />
                <xs:element name="email" type="xs:string" />
                <xs:element name="password" type="xs:string" />
            </xs:sequence>
            <xs:attribute name="id" type="xs:int" />
        </xs:complexType>
    </xs:element>

    <xs:element name="users">
        <xs:complexType>
            <xs:sequence>
                <xs:element ref="user" maxOccurs="unbounded" />
            </xs:sequence>
        </xs:complexType>
    </xs:element>

</xs:schema>